{
    "$schema": "http://json-schema.org/draft-04/schema#",
    "type": "object",
    "title": "Period",
    "properties": {
        "from": {
            "title": "From date",
            "type": "string",
            "format": "date"
        },
        "to": {
            "title": "To date",
            "type": "string",
            "format": "date"
        },
        "incomes": {
            "$ref": "uk-properties/other/Incomes.json"
        },
        "expenses": {
            "$ref": "uk-properties/Expenses.json"
        }
    },
    "required": [
        "from",
        "to"
    ],
    "additionalProperties": false
}
