{
  "from": "2017-04-06",
  "to": "2017-07-04",
  "incomes": {
    "rentIncome": {
      "amount": 100.25,
      "taxDeducted": 100.25
    },
    "premiumsOfLeaseGrant": { "amount": 100.25 },
    "reversePremiums": { "amount": 100.25 }
  },
  "expenses": {
    "consolidatedExpenses": { "amount": 200.25 },
    "residentialFinancialCost": { "amount": 200.25 }
  }
}
