{
  "from": "2017-04-06",
  "to": "2017-07-04",
  "incomes": {
    "rentIncome": {
      "amount": 100.25
    }
  },
  "expenses": {
    "premisesRunningCosts": { "amount": 100.25 },
    "repairsAndMaintenance": { "amount": 100.25 },
    "financialCosts": { "amount": 100.25 },
    "professionalFees": { "amount": 100.25 },
    "other": { "amount": 100.25 }
  }
}
